{
  "capture_packet_count": 11,
  "capture_sha256": "5f97ad0fffa68908bee6c58e451cfc7e1aac8864d65e2d843cefce2bd85a2127",
  "capture_size_bytes": 1512,
  "case_id": "public-5gc-access-plmn-recovery",
  "first_frame": 1,
  "first_timestamp": "1785304726.068940000",
  "last_frame": 11,
  "last_timestamp": "1785304726.071861000",
  "notes": [
    "Public capture from abdelrahman-fawaz18/5g-sa-core-protocol-lab"
  ],
  "protocol_inventory": [
    "SCTP",
    "NGAP"
  ],
  "source_capture_path": "captures/fault-injection/plmn-mismatch/recovery.pcap",
  "source_class": "external-public-capture",
  "source_commit": "82934c2cc231540fa425e48177d4bed33210bfc1",
  "source_repository": "abdelrahman-fawaz18/5g-sa-core-protocol-lab",
  "upstream_scenario_intent": "plmn recovery resulting in NGSetupResponse"
}
